Company Name,Batch,Short Description,Detail URL
Golf,Spring 2025,Open-source platform for building production MCP servers,https://www.ycombinator.com/companies/golf
BitBoard,Spring 2025,The AI workforce for healthcare operations.,https://www.ycombinator.com/companies/bitboard
nao Labs,Spring 2025,Cursor for data teams.,https://www.ycombinator.com/companies/nao-labs
Vybe,Spring 2025,Lovable for internal apps,https://www.ycombinator.com/companies/vybe
Aravolta,Spring 2025,"Software to monitor, control, and optimize data centers.",https://www.ycombinator.com/companies/aravolta
Kashikoi,Spring 2025,Simulation Engine for Benchmarking AI Products,https://www.ycombinator.com/companies/kashikoi
Plexe,Spring 2025,Open-source agents to build predictive ML models from a prompt,https://www.ycombinator.com/companies/plexe
RescueTime,Winter 2008,Take Back Control of your Time,https://www.ycombinator.com/companies/rescuetime
Frekil,Spring 2025,Scale AI for Medical Scans,https://www.ycombinator.com/companies/frekil
Chestnut,Spring 2025,The first AI mortgage lender,https://www.ycombinator.com/companies/chestnut
Red Barn Robotics,Winter 2025,A Roomba for weeds on a farm.,https://www.ycombinator.com/companies/red-barn-robotics
QFEX,Spring 2025,24/7 Global Stock Exchange,https://www.ycombinator.com/companies/qfex
Blaxel,Spring 2025,AWS for AI Agents,https://www.ycombinator.com/companies/blaxel
Mentra,Winter 2025,Building the open source smart glasses operating system.,https://www.ycombinator.com/companies/mentra
BlindPay,Winter 2025,Stablecoin API for global payments,https://www.ycombinator.com/companies/blindpay
Vantel,Winter 2025,AI Software for Commercial Insurance Brokers,https://www.ycombinator.com/companies/vantel
Fira,Winter 2025,Agentic AI platform for investment firms,https://www.ycombinator.com/companies/fira
assistant-ui,Winter 2025,Open Source React.js Library for AI Chat,https://www.ycombinator.com/companies/assistant-ui
Artifact,Winter 2025,"An Collaborative, AI-native IDE for Hardware Engineers",https://www.ycombinator.com/companies/artifact-2
Axal,Winter 2025,The AI Software Architect,https://www.ycombinator.com/companies/axal
ThirdLayer,Winter 2025,"Building Dex, the AI Browser Copilot",https://www.ycombinator.com/companies/thirdlayer
TrainLoop,Winter 2025,Reasoning Fine-Tuning,https://www.ycombinator.com/companies/trainloop
Tally,Winter 2025,AI accounting,https://www.ycombinator.com/companies/tally-2
SAMMY Labs,Winter 2025,"Live, AI-powered graph of every possible click path in your software",https://www.ycombinator.com/companies/sammy-labs
Instinct,Winter 2025,Building the lunar future.,https://www.ycombinator.com/companies/instinct
Mercura,Winter 2025,AI Quoting for distributors and manufacturers,https://www.ycombinator.com/companies/mercura
emojis.com,Winter 2025,AI Copilot for Graphic Design,https://www.ycombinator.com/companies/emojis-com
Cedar,Winter 2025,In-product AI copilot for any app,https://www.ycombinator.com/companies/cedar
Browser Use,Winter 2025,Leading open-source web agent project with 50k stars in 3 months,https://www.ycombinator.com/companies/browser-use
TamLabs,Winter 2025,Cursor for Microsoft Word,https://www.ycombinator.com/companies/tamlabs
Ergo,Winter 2025,AI Agents for Sales Operations,https://www.ycombinator.com/companies/ergo
CopyCat,Winter 2025,"Next-Gen RPA, Powered by Browser Agents",https://www.ycombinator.com/companies/copycat
Paratus Health,Winter 2025,AI-powered intake nurse,https://www.ycombinator.com/companies/paratus-health
Atlog,Spring 2025,Voice Agents for Physical Retail Stores,https://www.ycombinator.com/companies/atlog
Pig,Winter 2025,Behavioral Cache for Agents,https://www.ycombinator.com/companies/pig
Bluebook,Winter 2025,AI for accounting,https://www.ycombinator.com/companies/bluebook
TensorPool,Winter 2025,Vercel For GPUs,https://www.ycombinator.com/companies/tensorpool
Waffle,Spring 2025,AI Operating System for SMBs,https://www.ycombinator.com/companies/waffle
Dalus,Winter 2025,AI-Powered Hardware System Design Software,https://www.ycombinator.com/companies/dalus
Roark,Winter 2025,Datadog for Voice AI,https://www.ycombinator.com/companies/roark
Rebolt,Winter 2025,AI Agents to Replace Restaurant Managers,https://www.ycombinator.com/companies/rebolt
Spott,Winter 2025,AI agents for recruiting firms,https://www.ycombinator.com/companies/spott
Woz,Winter 2025,AI platform enabling anyone to build and scale software businesses,https://www.ycombinator.com/companies/woz
Proception Inc,Winter 2025,Making humanoids dexterous enough to thread a needle,https://www.ycombinator.com/companies/proception-inc
Demeter,Winter 2025,AI Value Creation Team for Private Equity,https://www.ycombinator.com/companies/demeter
Wildcard,Winter 2025,Make APIs work for AI Agents,https://www.ycombinator.com/companies/wildcard
Permitify,Winter 2025,AI co-pilot for building plan review and building code compliance,https://www.ycombinator.com/companies/permitify
Reditus Space,Winter 2025,Reusable Satellites for zero-g manufacturing,https://www.ycombinator.com/companies/reditus-space
Optifye.ai,Winter 2025,AI performance monitoring for factory workers,https://www.ycombinator.com/companies/optifye-ai
Pinch,Winter 2025,Video conferencing with real-time voice translation,https://www.ycombinator.com/companies/pinch
Retrofit,Winter 2025,A vintage marketplace curated by AI,https://www.ycombinator.com/companies/retrofit
Archon,Winter 2025,We help software companies sell to government.,https://www.ycombinator.com/companies/archon
Forge Automation,Winter 2025,Software Enabled CNC Parts Supplier,https://www.ycombinator.com/companies/forge-automation
Mastra,Winter 2025,"The Javascript framework for building AI agents, from the Gatsby devs",https://www.ycombinator.com/companies/mastra
AfterQuery,Winter 2025,Research lab investigating the boundaries of AI capabilities.,https://www.ycombinator.com/companies/afterquery
Misprint,Winter 2025,Misprint is building Robinhood for Pokemon cards,https://www.ycombinator.com/companies/misprint
FuseAI,Winter 2025,The only sales software you will ever need.,https://www.ycombinator.com/companies/fuseai
Miyagi Labs,Winter 2025,Shopify for AI-generated courses,https://www.ycombinator.com/companies/miyagi-labs
Artificial Societies,Winter 2025,We use AI to simulate entire human societies,https://www.ycombinator.com/companies/artificial-societies
TripleZip,Winter 2025,Automating CRE accounting with AI,https://www.ycombinator.com/companies/triplezip
Peppr AI,Winter 2025,Self-improving knowledge base synthesizing scattered company data,https://www.ycombinator.com/companies/peppr-ai
Infinite,Winter 2025,Global B2B Stablecoin Processor,https://www.ycombinator.com/companies/infinite
